{
  "schema_version": "1.0.0",
  "package_id": "@northstar/synthetic-language",
  "version": "0.1.0",
  "kind": "language-quality",
  "compatible_core_range": ">=0.2.0 <1.0.0",
  "supported_languages": [
    "quantum-lang"
  ],
  "supported_overlays": [
    "base"
  ],
  "available_workflows": [
    "explicit_audit_repair"
  ],
  "entrypoints": {
    "explicit_audit_repair": "references/fixture-audit.md"
  },
  "runtime_capabilities": {
    "required_commands": [
      "sh"
    ],
    "optional_effigy_selectors": []
  },
  "self_check": {
    "entrypoint": "scripts/self-check.sh",
    "validated_profile_versions": [
      "1.0.0"
    ],
    "validated_schema_versions": [
      "1.0.0"
    ],
    "invocation": {
      "type": "command",
      "command": "sh"
    }
  },
  "evidence_providers": []
}
